Conversation	Speaker	Transcript
Text18	User	Hello there. I'm looking for a pizza. Do you know if your vegan pizza is organic?
Text18	Clerk	All of our ingredients are locally sourced and certified organic.
Text18	User	"Wow. Okay, I'd like two large vegan pizzas. With gluten free crusts. And three mineral waters."
Text18	Clerk	Great! Would you like any sides or desserts with that?
Text18	User	No thank you.
Text18	Clerk	"Alright, could I get your name and phone number?"
Text18	User	"My name is John Smith, 123-456-7890. Can I save this order to reuse later? Except with only two mineral waters instead of three?"
Text18	Clerk	"Definitely, give me a moment to save that. Ok, that is two large vegan pizzas with gluten free crusts and two mineral waters saved as your preferred order. Is today's order delivery or pick up?"
Text18	User	Yes. But three mineral waters tonight. Delivery please.
Text18	Clerk	"Yes, I have three mineral waters for today. Alright, your total will be $74.50, and it should take about 20 minutes."
Text18	User	"Okay, thank you Jane!"
Text18	Clerk	Have a good night!
Text19	Clerk	"Generic pizza place, Jane speaking."
Text19	User	"Hello, I would like a small Hawaiian pizza. Thin crust. And some cheese sticks."
Text19	Clerk	Would you like a drink or dessert?
Text19	User	No thank you. How long will it be?
Text19	Clerk	It will take about 10 minutes to cook. Is this delivery or pick up?
Text19	User	Can I get it delivered to Generic High School?
Text19	Clerk	Sure. What is the street address?
Text19	User	"1234 Main St, New City, AB 12345"
Text19	Clerk	"Your total will be $28, and it will arrive in about 15 minutes. Is there anything else you need today?"
Text19	User	"That's it, thanks."
Text19	Clerk	Goodbye.
Text20	Clerk	"Hello, thank you for calling generic pizza place! What can I get for you today?"
Text20	User	I want two large deep dish pizzas. With everything on them.
Text20	Clerk	"Sure! That would be two large deep dish pizzas with mozzarella, cheddar, swiss, provolone, pineapple, green peppers, red onions, mushrooms, black olives, pepperoni, ham, bacon, and sausage. Is that correct?"
Text20	User	Yes. And extra pineapple on one of them.
Text20	Clerk	"Alright, extra pineapple on one. Would you like any drinks, sides, or desserts today?"
Text20	User	No thank you. Just the pizzas today.
Text20	Clerk	"Ok, sounds good. Is this for pick up?"
Text20	User	Yes.
Text20	Clerk	"Great, added to the pick up list. Could I get your name?"
Text20	User	Smith. 456-7890
Text20	Clerk	"Alright, that will be ready in about 20 minutes. We will see you then!"
Text20	User	Thank you.
Text20	Clerk	Your total will be $88.
Text20	User	"Okay, thanks!"
Abnormal1	Clerk	"Thank you for calling generic pizza place! This is Jane, how can I help you?"
Abnormal1	User	"Hi. I'm looking for three large pepperoni pizzas. Also three colas. And wait hold on, give me a moment. Uhhhh has anyone seen Max? Max? Does anyone remember what he can't eat? Okay hold on, I need to find a buddy of mine. Give me just a few minutes. Actually you know what, I'll call you back. Uhh just so you know my name is John Smith."
Abnormal1	Clerk	"Ok, thank you."
Abnormal1	Clerk	"Hello, this is generic pizza place. How can I help?"
Abnormal1	User	"Hi, this is John from before. We found Max. And he can't have cheese for some reason. So that complicates things."
Abnormal1	Clerk	"One minute, I think Jane was on the phones earlier."
Abnormal1	User	Oh.
Abnormal1	Clerk	"Hey Jane, did you have a John earlier? You wrote the order down?"
Abnormal1	User	Uhh I think I'd ordered three large pizzas. Or maybe it was two.
Abnormal1	Clerk	"Yes, I found the note from earlier. I have three large pepperoni pizzas and three colas Did you want to do one of those without cheese?"
Abnormal1	User	"Okay, well I'd like one of those pepperonis without cheese. Yes exactly. Thank you. The three colas are still good to go."
Abnormal1	Clerk	"Great, we can do that. Is that for delivery or pick-up?"
Abnormal1	User	That would be for delivery. My address is 1234 Main St.
Abnormal1	Clerk	"Alright, your total will be $66, and it will take about 20 minutes. Anything else you need today?"
Abnormal1	User	"No, that's it from me."
Abnormal1	Clerk	"Alright, thank you for your order. Have a nice day!"
Abnormal1	User	Thank you.
Abnormal2	Clerk	"Hello, generic pizza place. What can I get for you?"
Abnormal2	User	"Hi, I'd like a small veggie pizza and a salad."
Abnormal2	Clerk	"Sure. We have a both a green salad and a Caesar salad, which would you like?"
Abnormal2	User	Hmm. Maybe the Caesar.
Abnormal2	Clerk	"Ok, a small veggie pizza and ... sa ... d .... els .... to ....ay ...."
Abnormal2	User	"What? Sorry, I think you might be breaking up. Can you repeat that?"
Abnormal2	Clerk	Is there any....... else ...... get yo....... day?
Abnormal2	User	That's it. My name is John.
Abnormal2	Clerk	Deli...... or.... up?
Abnormal2	User	Uhh. Pick up.
Abnormal2	Clerk	.....33.50....minu.....tha......ou
Abnormal2	User	Uhh okay sure. Thanks.
Abnormal3	Clerk	"Hello, this is generic pizza place. What can I get you?"
Abnormal3	User	"Hi, can I just get a small pepperoni pizza?"
Abnormal3	Clerk	"Yeah, sure. That all?"
Abnormal3	User	"Um, yeah, that's all. How much is that?"
Abnormal3	Clerk	$14.00
Abnormal3	User	"Oh, um, do you do slices?"
Abnormal3	Clerk	"Hold on, let me ask. No, unfortunately we do not sell by the slice."
Abnormal3	User	"Oh, alright, never mind."
Abnormal4	Clerk	"Hello, this is generic pizza place. Just a heads up, all of our ovens are currently out of commission. But is there anything I can help you with?"
Abnormal4	User	"Oh, so you're not doing pizza right now?"
Abnormal4	Clerk	"No we are not. The only things we currently have are salads, drinks, and desserts."
Abnormal4	User	"Oh well, I guess I can eat healthier for one night. Uh, could I get a Caesar salad, a root beer, and a slice of chocolate cake?"
Abnormal4	Clerk	"Okay, sure, we can get you that. Did you want to pick it up?"
Abnormal4	User	"Yeah, I'll do that."
Abnormal4	Clerk	"Okay, that'll be $20.50. What was your name?"
Abnormal4	User	Jane Doe.
Abnormal4	Clerk	Okay Jane. It's ready whenever you get here. See you soon.